{
  "flow_version": 1,
  "subsidy_id": "fixture-good",
  "subsidy_name": "Fixture subsidy spec",
  "round": null,
  "spec_path": "tools/fixtures/spec/good-spec.json",
  "spec_version": 1,
  "lanes": [
    { "lane_id": "owner", "label": "経営者（あなた）" },
    { "lane_id": "claude", "label": "Claude Code との作業" },
    { "lane_id": "external", "label": "外部の窓口" }
  ],
  "steps": [
    {
      "step_id": "kit-consult",
      "origin": "kit",
      "base_step_id": "consult",
      "label": "補助金申請について相談する",
      "description": null,
      "lane": "claude",
      "zone": "application",
      "kind": "process",
      "human_gate": false,
      "deliverable_ids": [],
      "event_ids": [],
      "clause_ids": [],
      "deadline": null,
      "deadline_time": null,
      "issuer": null,
      "next": ["sp-ghost"],
      "branches": []
    },
    {
      "step_id": "sp-ghost",
      "origin": "derived",
      "base_step_id": null,
      "label": "存在しない成果物を用意する",
      "description": null,
      "lane": "owner",
      "zone": "application",
      "kind": "process",
      "human_gate": false,
      "deliverable_ids": ["no-such-deliverable"],
      "event_ids": [],
      "clause_ids": [],
      "deadline": null,
      "deadline_time": null,
      "issuer": null,
      "next": [],
      "branches": []
    }
  ]
}
